,Username,Tweet,Likes,Retweets,No
622,mat4g13,"RT @KKMPutrajaya: KKM menyarankan kepada semua untuk menangguhkan perjalanan ke negara-negara yang berisiko tinggi berikutan varian Omicron yang kian menular. 

Dapatkan vaksin COVID-19 termasuk dos penggalak sebagai usaha kita melindungi diri dan keluar… https://t.co/eeBtp42dUY",0,0,622
623,aiiptu,"Pemerintah Indonesia sudah memulai pemberian vaksin Covid-19 bagi anak-anak usia 6-11 tahun.

Pemberian vaksin bagi anak usia 6-11 tahun ini bertujuan melindungi mereka dari paparan Covid-19 dan memberikan keamanan saat melaksanakan pembelajaran tatap muka (PTM) terbatas. https://t.co/SGs12N4t4d",21,18,623
624,abi_sasaLL,"Pemberian vaksin bagi anak usia 6-12 tahun ini bertujuan melindungi mereka dari paparan Covid-19 dan memberikan keamanan saat melaksanakan PTM terbatas.
mendapatkan vaksin Covid-19 Secara tidak sudah turut menjaga lingkungan terdekat dari virus Covid-19. https://t.co/FadEu1DDs0",18,16,624
625,riea_mariska86,"Vaksinasi Covid -19 mampu memberikan perlindungan yang aman dan efektif terhadap virus penyebab Covid-19, sehingga melindungi anak tertular Covid-19.

Selain itu, mendapatkan vaksin Covid -19 juga akan membantu mencegah mereka dari sakit parah bahkan jika mereka terkena Covid-19. https://t.co/zZzOayc8D1",20,18,625
626,forjakeu,"Dengan adanya vaksinasi tentu saja sangat penting untuk mengantisipasi berkembangnya varian baru Omicron di Indonesia.

Maka dari itu kita wajib vaksin krn sangat penting demi terwujudnya herd imunity sehingga penularan Covid-19 varian baru bisa dicegah &amp; jangan lupa jaga prokes. https://t.co/ULHzK1OvAd",18,17,626
627,tvOneNews,"Bocah SD di Jombang Meninggal Usai Vaksin Covid-19, Dinkes Telusuri Riwayat Kesehatan Korban https://t.co/X3d04ZeKhg",780,444,627
628,kotajakpus,"Vaksinasi ini dilakukan dengan tujuan untuk mendorong tercapainya herd immunity pada anak-anak (peserta didik) di masa pandemi Covid-19.

Salah satu peserta vaksin, Nizam yang datang diantar dengan orang tuanya mengatakan bahwa vaksinasi ini tidak sakit, jadi jangan takut ya! https://t.co/HMitNvzIsH",2,0,628
629,idntimes,Viral! Seorang Pria Meninggal Usai Disuntik Vaksin COVID 19 di Bima https://t.co/VoNE1wB0nO,1,0,629
630,made_in_INA,"@VFathun Nah ini yg perlu di jelaskan oleh pemerintah, jgn hanya berani ancam klo blm vaksin gak bisa ini itu...giliran ada kasus begini tiba2 pada buang badan semua.

Kami2 pd dasar nya siap dukung program pemerintah utk pencegahan covid-19, asal semua transparan.",5,0,630
631,JeparaPolres,Polres Jepara Jemput Lansia dan Suntikkan Vaksin Covid-19 Guna Percepat Vaksinasi https://t.co/8jwA9Fug1h,0,0,631
632,mnctrijaya,"Agar, Indonesia bisa mendapatkan akses vaksin Covid-19 dengan mudah.

""Pencarian pasokan vaksin mulanya menyasar para lembaga dunia, seperti Badan Kesehatan Dunia (WHO), Organisasi Pendanaan Anak PBB (UNICEF), Bank Dunia, hingga Bank Pembangunan Asia (ADB),""",0,0,632
633,mnctrijaya,"Menteri Keuangan (Menkeu) Sri Mulyani bercerita pengalamannya mengejar pasokan vaksin covid-19. Demi mendapat stok vaksin covid-19, Sri Mulyani ke berbagai lembaga dunia hingga yayasan sosial seperti Bill dan Melinda Gates Foundation pada masa awal pandemi. https://t.co/NKxtz1tYaQ",0,0,633
634,hypeabisid,Benarkah Vaksin Covid-19 Tidak Efektif Melawan Omicron? Simak Penjelasan Ini https://t.co/8UegqexKGK https://t.co/UHH3rGRQvG,0,0,634
635,jawapos,Forum Umat Muslim Minta Kemenkes Vaksin Halal untuk Tangani Covid-19 https://t.co/XjNNXVLwmJ,2,0,635
636,13_bener,"Kita berharap setelah di vaksin, imun tubuh kita semakin meningkat.
Sehingga hal buruk terpapar virus Covid-19 bisa di minimalisir.

#pendamdiponegoro #kodimpurworejo https://t.co/5oUCyDEydN",0,0,636
637,KATADATAcoid,"Menteri Kesehatan Budi Gunadi Sadikin mengatakan, kemudahan pasokan vaksin Covid-19 di Indonesia berkat Menteri Luar Negeri Retno Marsudi dan Menteri Keuangan Sri Mulyani.

https://t.co/NVvi4hT1bB",3,0,637
638,kemkominfo,"Badan Pengawas Obat dan Makanan Indonesia sudah memberikan izin penggunaan darurat pada 10 jenis vaksin COVID-19, yakni Sinovac, AstraZeneca, Sinopharm, Moderna, Pfizer, Novavax, Sputnik-V, Janssen, Convidencia, dan Zifivax.

#IndonesiaBangkit https://t.co/4JOIdJKipd",13,7,638
639,UKASSarawak,"PROGRAM VAKSINASI COVID-19 PEJABAT KESIHATAN DAERAH MARUDI

Pusat Pemberian Vaksin (PPV) Marudi akan ditutup mulai 30 Disember 2021 hingga 2 Januari 2022 dan akan dibuka semula pada 3 Januari 2022. 

#UKASnews https://t.co/GrEj1Nqc4z",0,1,639
640,Polantastgms,"Pengawalan Pendistribusian Vaksin Covid-19 (Distribusi Dinkes Prov. Bengkulu) Dari Perbatasan Pugung Kab. Tanggamus s.d. Perbatasan Pesisir Barat
. https://t.co/nXNHrROdYS",0,0,640
641,mnctrijaya,"""Selain sejumlah persyaratan yang harus dipenuhi dari sisi berkas, penumpang juga akan diukur suhu tubuh saat pengecekan tiket. Jika suhu tubuh diatas 37,3 derajat maka penumpang tidak diizinkan berangkat meskipun berkas persyaratan vaksin dan pemeriksaan Covid 19 telah lengkap",0,0,641
642,humaspolsulteng,"AYO VAKSIN
Wujudkan masyarakat sehat dan produktif dengan vaksinasi covid-19

#UtamakanPatuhiProkes
Dukung Percepat Vaksinasi https://t.co/0UamTgBNU7",3,1,642
643,Polantastgms,Polres Tanggamus melaksanakan kegiatan vaksinasi Covid-19 gratis di Gerai Vaksin Polres Tanggamus yang berlokasi di Pos Pam Ops Lilin Krakatau 2021. https://t.co/kD9KUZeHWd,0,0,643
644,suaradiponegoro,"Babinsa Kel. Pajang Pantau Giat Vaksin Covid 19 Untuk Usia 6 Tahun s.d 12 Tahun Keatas

https://t.co/CKDwirj2pl

#tniad
#suaradiponegoro
#bersamarakyattnikuat https://t.co/xM3NQj0oi1",1,0,644
645,celebdotid,"Krisdayanti Dampingi Amora dan Kellen Vaksin Covid-19

#CelebritiesDotID #InfoCelebTerkini 
https://t.co/OVlYqUnThm",0,0,645
646,CecepMadjid,@CNNIndonesia Alhamdulillah di Indonesia Moda KA tdk seperti ini. Mdh2an Covid 19 cepat musnah agar Kehidupan Rakyat Indonesia Normal Kembali. Mari Vaksin biar Negeri kita cepat Sembuh dari Penularan Virus Covid 19 model baru 🤲🙏,0,0,646
647,pendimpati0718,"Pendampingan Vaksinasi covid-19 bertempat di Balai Desa Sugihrejo kecamatan Gabus Vaksinasi Dosis 2 Vaksin  Astrazeneca Pencapaian  330 orang.Rabu,(29/12/2021) https://t.co/8vzEpaXpOY",0,0,647
648,mcreativepky,"Dukung Percepatan Vaksinasi, Polresta Palangka Raya Pam Gudang dan Distribusi Vaksin Covid-19 https://t.co/rtCK3z8qUu",0,0,648
649,holopiscom,"Program vaksinasi COVID-19 di Indonesia mulai dilakukan oleh pemerintah, (13/1). Orang yang pertama kali disuntik vaksin buatan Sinovac adalah Presiden Joko Widodo. 
#Kaleidoskop2021
#Vaksinasi
@jokowi
https://t.co/ciaoV04AFR",0,0,649
650,ruangtunggu,Aman dan Nyaman saat vaksin Covid-19 https://t.co/V1Hs0FeKGT,0,0,650
651,medcom_id,[Cek Fakta] Video Penampakan Nanorobot di dalam Vaksin Covid-19? Ini Faktanya https://t.co/hMBKDruxC2,2,1,651
652,PolresWonogiri2,"Tangkis Corona Dengan Vaksinasi

Polres Wonogiri terus berupaya mempercepat akselerasi vaksinasi Covid-19, salah satunya dengan vaksinasi massal secara serentak di Wonogiri . Yuk segera vaksin. Vaksin aman dan halal. https://t.co/uB0Wjr4wei",1,0,652
653,beritamanado,"Berita terbaru: Di Penghujung Tahun 2021, BIN Sulut Tetap Konsisten Gelar Vaksinasi https://t.co/2xysCD6VC0 #BIN_Sulut #Vaksin_BIN #Vaksin_Covid-19",0,0,653
654,BatamPos,"Ratusan Anak Toapaya Antusias Ikuti Vaksinasi Covid-19, Roby: Orangtua Jangan Khawatir, Vaksin Aman https://t.co/B80xqy7tCA",0,0,654
655,TweetsFromAlma,"Kejar Target, Petugas Gabungan di Tanta Tabalong Stop Pengendara Agar Mau di Vaksin COVID-19  &amp;nbsp; https://t.co/gxweazgUfR",0,0,655
656,beautynesia_id,"Catat! Vaksin Booster Covid-19 Akan Dikenakan Biaya Mulai Januari 2022, Cek Harganya di Sini... https://t.co/LPH4TfEfE2",0,0,656
657,idntimes,VIRAL! SEORANG PRIA MENINGGAL USAI DISUNTIK VAKSIN COVID-19 DI BIMA https://t.co/jvtXEoE9uy,1,0,657
658,HUMASPolrespyk,Sumbar Sadar Vaksin Covid-19 Ciptakan Kekebalan Bersama Diwilkum Polres Payakumbuh https://t.co/bTWgguur83,1,0,658
659,Riskaoktaa,"Aku main quora, ditanyain gimana cara menghadapi covid-19 varian baru. Jelas kan jawabannya cuma 2. Vaksin bagi yg belum dan perketat prokes.",0,0,659
660,beritartm,"29 Disember - Vaksin COVID-19 : Rakyat Mexico serbu pusat vaksinasi
https://t.co/1DBRDIXGHv

'Yang sahih di Berita RTM'
#RTM #BeritaRTM #KeluargaMalaysia #COVID19Malaysia #Banjir https://t.co/HQggnjXQJ9",1,2,660
661,dikareza6,Ketersediaan Stok Vaksin Covid-19 #DisiplinProtokolKesehatan #VaksinCovid19  #BersatuLawanCovid19 https://t.co/dlMY7GHWkA,1,0,661
662,dikareza6,Ketersediaan Stok Vaksin Covid-19 #DisiplinProtokolKesehatan #VaksinCovid19  #BersatuLawanCovid19 https://t.co/YKuPzi1tmN,1,0,662
663,dikareza6,Ketersediaan Stok Vaksin Covid-19 #DisiplinProtokolKesehatan #VaksinCovid19  #BersatuLawanCovid19 https://t.co/IdU5dpn6V2,1,0,663
664,dikareza6,Ketersediaan Stok Vaksin Covid-19 #DisiplinProtokolKesehatan #VaksinCovid19  #BersatuLawanCovid19 https://t.co/aZzUyXG2CM,1,0,664
665,MyKMUnet,Suntikan vaksin Covid-19 untuk kanak – kanak tapi bukan untuk anak saya – Presiden Brazil https://t.co/Ig9rI2CPFu,0,0,665
666,serambinews,"Seorang juara kickboxing asal Belgia sekaligus anti-vaksin meninggal dunia karena Covid-19.

https://t.co/Uhhsvsp3AA",0,0,666
667,HUMASPolrespyk,Sumbar Sadar Vaksin Covid-19 Ciptakan Kekebalan Bersama Diwilkum Polres Payakumbuh https://t.co/lAa5U1VrLF,1,0,667
668,KitaPalaBataih,"Hospital medan ATM Pulau Pinang dan ICU hospital medan ATM Kepala Batas ditutup secara rasminya pada hari ini selepas angka kes Covid-19  telah menurun hasil kejayaan dan keberkesanan langkah mitigasi serta program vaksin di negara ini

https://t.co/vxOAkXZCqb",12,11,668
669,santai_tv,Hospital medan ATM Pulau Pinang dan ICU hospital medan ATM Kepala Batas ditutup secara rasminya pada hari ini selepas angka kes Covid-19  telah menurun hasil kejayaan dan keberkesanan langkah mitigasi serta program vaksin di negara ini https://t.co/bv5BIthCxN,2,2,669
670,Kiflin_1989,"Sebanyak 302 Warga di TTS Menerima Vaksin Covid-19 yang Digelar Polda NTT 
https://t.co/7Qvk6QP8hv 
#kupang #ntt #WARNANTT #NusaTenggaraTimur",0,0,670
671,KitaPalaBataih,Hospital medan ATM Pulau Pinang dan ICU hospital medan ATM Kepala Batas ditutup secara rasminya pada hari ini selepas angka kes Covid-19  telah menurun hasil kejayaan dan keberkesanan langkah mitigasi serta program vaksin di negara ini.,24,23,671
672,chatnews_id,"#Hoax soal vaksin Covid-19 ada 420. Tapi penyebarannya di media sosial sangat masif, dengan Facebook lebih dari 2.000 penyebaran.

https://t.co/UwSqCjXS8g",0,0,672
673,PR_Tasikmalaya,"Pemulang Rongsokan di Bima Meninggal Dunia Usai Suntik Vaksin Covid-19, Polisi: Sedang Dilakukan Penyelidikan https://t.co/Sp8uypFvBk",0,0,673
674,kundurnews,New post (Bupati Inhil Undi Pemenang Gebyar Pekan Vaksin Covid-19 Berhadiah 2 Unit Sepeda Motor) has been published on Kundur News - https://t.co/dJmYnvQbOO https://t.co/xPCPjU7Ycn,0,0,674
675,mutiarafm,"KKM menyarankan kepada semua untuk menangguhkan perjalanan ke negara-negara yang berisiko tinggi berikutan varian Omicron yang kian menular. 

Dapatkan vaksin COVID-19 termasuk dos penggalak sebagai usaha kita melindungi diri dan keluarga tersayang. 

#LindungDiriLindungSemua https://t.co/QjQDWwhYPU",0,0,675
676,kominfodiy,"""VIRALLL....#Fyp JUST INFO DARI KANTOR PBB WHO UNTUK VAKSIN DI SELURUH DUNIA HARUS DI BERHENTIKAN."". 

Faktanya, informasi yang mengklaim bahwa PBB dan WHO akan menghentikan seluruh Vaksinasi COVID-19 di dunia tersebut adalah tidak benar.",0,0,676
677,IkhsanN75080567,"Badan Intelijen Negara Daerah Jambi Beri Semangat Nakes pada Pelaksanan Vaksin Covid-19
https://t.co/Pv91vvDq56",0,0,677
678,swarakonsumeni2,Kapolsek Sukra Jajaran Polres Indramayu Monitoring dan Pam Giat Gerai Vaksin Presisi COVID-19 di Wilayahnya https://t.co/6QkBWnE8ru,0,0,678
679,trenasia_com,"Impor Vaksin Bakar Duit, Erick: Vaksin COVID-19 Buatan Bio Farma akan Diproduksi Juli 2022 https://t.co/I3uxbu0a6a",0,0,679
680,kotajakbar,"Sudah 78.462 atau 29,84% anak di Jakarta Barat yang telah di vaksin.

Salah satu upaya yang dilakukan untuk segera mengakhiri pandemi covid-19 adalah dengan vaksinasi.

#PemkotJB #VaksinDulu #SukseskanVaksinasi #JagaJakarta https://t.co/v9ZvXbsbCn",0,0,680
681,RadioElshinta,Gubernur Jateng @ganjarpranowo menemani anak-anak MI di Boyolali mendapatkan suntikan vaksin Covid-19. (Humas Pemprov Jateng) #DengerinElshinta https://t.co/F64YaHLJrr,4,1,681
682,YudiSet16452924,"@alisyarief @mohmahfudmd Masyarakat menjadi tahu bahwa covid 19 hanyalah bisnis para pejabat yang terselubung, yg pada akhirnya masyarakat enggan untuk di vaksin, sementara pemerintah memaksakan dengan kewenanganya tanpa perduli melanggar HAM tentang kesehatan masyarakat",2,1,682
683,UdinKahar6,"Pentingnya Vaksin Covid - 19 untuk anak 
Disiplin Protokol Kesehatan https://t.co/in2LhPErOs",0,0,683
684,pemdescikendung,"Vaksin Covid-19 Desa Cikendung 
@muktiagungwbw @wakilbupatipml @puspindes @kecpulosari_pml https://t.co/WPg5OFxZvx",0,0,684
685,yudhi_sh,"Mengingat bahwa vaksin covid-19 masih bersifat Emergency Use Authorization dari WHO penggunaannya, mk pd setiap kasus KIPI &amp; kematian pasca vaksin yg terindikasi erat sebab-akibatnya, harus dilakukan pendalaman hingga dpt dipastikan penyebabnya &amp; dipublikasikan di negara manapun.",2,0,685
686,voidotid,Provinsi Quebec juga akan menawarkan dosis ketiga atau booster vaksin COVID-19 kepada semua orang di atas usia 18 tahun mulai 4 Januari. https://t.co/UEu3cWEmrk,0,0,686
687,PolsekPangalen7,"Monitoring Giat Vaksin, Dukung Percepatan Penanganan Covid-19 https://t.co/DN53lhbZq2",0,0,687
688,Herians1010,Pentingnya vaksin Covid-19 untuk ajak. Disiplin Protokol Kesehatan https://t.co/5pGryk2QyQ,0,0,688
689,NSTENDA,SEWA VAKSIN COVID-19 MANGGARAI JAKARTA SELATAN https://t.co/nYbBahSB6b,0,0,689
690,BentengSumbar,"Jangan Lupa! Vaksin Dosis 3 COVID-19 Bulan Januari Tidak Gratis, Berapa Harganya? - https://t.co/ES12AEQC6r",0,0,690
691,NSTENDA,SEWA TENDA VAKSIN COVID-19 LENTENG AGUNG JAKARTA SELATAN https://t.co/Pxq1smWVYb,0,0,691
692,lawancovid19_id,"Atau, cara lainnya adalah dengan vaksinasi mobile yang langsung ""jemput bola"", alias vaksinatornya langsung mendatangi masyarakat yang belum mendapat vaksin COVID-19.

Kalau di sekitarmu, apakah ada terobosan pelaksanaan vaksinasi yang bisa ditiru?",0,0,692
693,1424Kodim,"Babinsa Desa Bonto, Koramil 1424-03/Sinjai Tengah, (Sertu Sugiaro) melaksanakan komunikasi sosial.bersama dengan warga di dusun Bululohe desa Bonto dan mengajak kepada warga yang belum melaksanakan vaksin covid 19.agar segera melaksanakan vaksin. (Rabu, 29/12/2021). https://t.co/0cVfTUlXzS",1,0,693
694,bumninc_id,"PT Bio Farma akan memproduksi vaksin BUMN secara mandiri pada 2022. Jika data hasil uji klinik mendukung, perseroan menargetkan vaksin Covid-19 itu mendapat Izin penggunaan darurat (EUA) pada Juli 2022.

Yuk baca di https://t.co/4bR1yb65sv

#beritabumn
#bumninc
#bumnincom",0,0,694
695,kodim0313kpr,"Bersinergi, Danramil 05/KK Laksanakan Razia Vaksin bersama Polsek dan Tim Satgas Covid-19, Demi Herd Immunity https://t.co/wuO9hd05M6",0,0,695
696,Fortune_IDN,Holding farmasi BUMN tengah mengembangkan vaksin Covid-19. https://t.co/iKH8XG9NEP,0,0,696
697,hmetromy,"#KualaLumpur Sebanyak 22,846,708 individu atau 97.6 peratus populasi dewasa di negara ini lengkap menerima suntikan vaksin Covid-19 setakat semalam.
https://t.co/8lkIbRmt0f",1,0,697
698,kumparan,"Sri Mulyani mengungkapkan upaya Indonesia untuk mendapatkan vaksin COVID-19, termasuk adanya koneksi dengan berbagai pihak. https://t.co/2ulTbULo4B",2,0,698
699,pkm_cisadea,"#SobatNgalam, VAKSIN COVID-19 ANAK SEKOLAH
Kemarin tanggal 28 Desember 2021 puskesmas Cisadea melakukan Vaksinasi Covid 19 bagi anak sekolah di sekolahan SDN Purwantoro 7. Sasaran anak sekolah yang divaksin  sebanyak kurang lebih  56 siswa yang terdiri dari kelas 1 sampai kelas 6 https://t.co/z5ur1vLAmR",3,5,699
700,21BeritaTerkini,Polisi Ungkap Kronologi Pemulung Di Bima Meninggal Usai Disuntik Vaksin Covid-19 https://t.co/8yLyOfC73b,0,0,700
701,aduankonten,"Di tengah vaksinasi yang sedang digalakkan, ada banyak DISINFORMASI ataupun HOAKS yang tersebar, Salah satunya adalah [HOAKS] lonjakan protein pada anak usai disuntik vaksin Covid-19 yang menyebabkan kerusakan organ tubuh. Simak Fakta nya! #AduanKonten https://t.co/c2MXpT9zQq",1,0,701
702,suaramerdeka,"Semua Vaksin Covid-19 Berpotensi Sebagai Booster, Termasuk Vaksin Merah Putih https://t.co/dNI2OkAqmZ",0,0,702
703,BernamaTV,"Bagi populasi remaja berusia 12 hingga 17 tahun pula, sejumlah 87.4 peratus atau 2,749,975 telah melengkapkan vaksinasi manakala 2,843,040 atau 90.4 peratus menerima sekurang-kurangnya satu dos vaksin COVID-19.

https://t.co/zXwTwYfVcw",0,0,703
704,BernamaTV,"Sebanyak 22,846,708 individu atau 97.6 peratus populasi dewasa di negara ini telah lengkap menerima suntikan vaksin COVID-19 setakat semalam. https://t.co/MZP9fJDEBn",4,1,704
705,datukhensem,"Just In:

53 Peratus Populasi Sarawak Telah Terima Dos Penggalak Vaksin COVID-19",8,3,705
706,radio_kotabatik,"Sedang berlangsung pengundian gebyar vaksin covid-19 tahun 2021 periode 29 November-18 Desember 2021 dengan hadiah utama 3 unit sepeda motor dan 4 sepeda kerjasama Pemkot Pekalongan, TNI, Polri dan Perbankan, Rabu 29/12/2021 di Lapangan Mataram.

(Info Kharisma Putri) https://t.co/qvQrK1L1qv",1,0,706
707,lampungpost_,"Jajaran Polsek Terbanggi Besar, Lampung Tengah bersama Satgas Covid-19 Kecamatan Terbanggibesar mengelar vaksin door to door dengan sasaran hotel dan tempat hiburan malam, Selasa, 28 Desember 2021. 

#Vaksin #Lampungtengah #Tempathiburan #lampostco
https://t.co/bG8OGP82KL",0,0,707
708,ditlantas_ntt,"Personil Ditlantas Polda NTT melaksanakan pengawalan dan pengamanan distribusi Vaksin Covid 19.

#poldantt #ditlantaspoldantt #presisi https://t.co/iD152Z4480",1,0,708
709,lantas_ngada,"PENGAWALAN VAKSIN COVID-19

Personil Satlantas Polres Ngada melaksanakan Pengamanan dan Pengawalan 2.900 Vial Vaksin Coronavac dari Bandara Turelelo Soa menuju Dinkes Kabupaten Ngada

Ayoo..!!! Jangan Kendor Untuk selalu Patuhi Prokes 5M.
Mencegah Lebih baik dari pada Mengobati. https://t.co/LuHIvTQQ1P",0,0,709
710,KODIM0722,Dukung Percepatan Vaksin Babinsa Dampingi Warga Saat Vaksinasi Covid-19 https://t.co/9Blz5QDA8i https://t.co/DpBz0ooKgF,0,0,710
711,jonathansurbak1,India Izinkan Pil Molnupiravir dan Dua Vaksin Covid-19 Buatan Dalam Negeri https://t.co/cXuL4xY2Cf,0,0,711
712,PR_Tasikmalaya,"Jadwal Vaksin Covid-19 di Surabaya Hari Ini, 29 Desember 2021, Tersedia Dosis 1 dan 2 https://t.co/rtts6FsNqD",0,0,712
713,gijnIndonesia,1) Pahami bagaimana sistem dalam industri kesehatan bekerja untuk bisa mengidentifikasi anomali dalam sistem. Cara ini pernah digunakan jurnalis untuk meliput tentang percepatan persetujuan peredaran vaksin COVID-19. https://t.co/Spghw9idax,0,0,713
714,RendySiregar90,"UPP Kab. Bantaeng melaksanakan giat pengamanan &amp; pendampingan vaksin covid-19 di desa bonto daeng kec. Uluere Sekaligus sosialisasi sapu bersih pungutan liar, melalui media masker yang digunakan oleh personil yg berlogokan saber pungli &amp; pemda",0,0,714
715,idai_tweets,"Simak pesan Ketua Umum IDAI Dr. Piprim Basarah Yanuarso, Sp.A(K) mengenai rekomendasi dari Ikatan Dokter Anak Indonesia mengenai pemberian vaksin COVID-19 (Coronavac) pada anak usia 6-11 tahun (pemutakhiran 16 Desember 2021) pada tautan berikut https://t.co/g58iQflmFQ",5,5,715
716,rutanlabdeli,"Kepada Para Warga Binaan Pemasyarakatan.
Bertempat di ruang kunjungan, sebanyak 114 orang Warga Binaan Pemasyarakatan Mendapatkan Vaksin Covid-19 Tahap I. kegiatan ini pun dilaksanakan dengan tetap Memperhatikan Protokol Kesehatan dimana para WBP https://t.co/VVHCFbgmn2",0,0,716
717,borneo24_com,Menlu Retno Nilai Stok Vaksin Covid-19 di Indonesia Bisa Untuk 3 Bulan ke Depan https://t.co/uldK2ENBEx,0,0,717
718,Aprilia_wiji,"Memenuhi kebutuhan vaksin covid 19 secara mandiri bagi masyarakat Indonesia adalah tujuan utama pengembangan vaksin covid 19 produksi dalam negeri.
Pemerintah terus mendorong agar vaksin covid-19 bisa diproduksi di dalam negeri untuk mengurangi ketergantungan impor.
@erickthohir https://t.co/OBZq4irO97",17,16,718
719,Aprilia_wiji,"Vaksin covid-19 dalam negeri produksi PT Biofarma Persero ini, sebanyak 77 juta akan mulai diproduksi bulan Juli 2022.
Hak nii sebagai penanda awal pengembangan vaksin covid 19 di Indonesia.
@erickthohir 
@KemenBUMN https://t.co/Hkojcyxrc7",17,16,719
720,Aprilia_wiji,"https://t.co/21sBpvFgYz
Menurut menteri BUMN @erickthohir pemerintah terus mendorong penyelesaian pengembangan vaksin dalam negeri, dan vaksin lokal yg diproduksi Biofarma menjalani uji klinis pertama 13 Desember 2021, sebanyak 77 juta vaksin covid-19 akan diproduksi Juli 2022.",19,20,720
721,gwabdeeeee,"Demi mencegah virus covid 19, kita wajib waspada dan selalu disiplin prokes ketat, bagi yg belum vaksinasi.. Yuk buruan di vaksin demi terwujudnya herd Immunity, sayangi diri dan keluarga.. https://t.co/lUiExIFtFb",1,1,721
722,JaPenWPKL,"@KKMPutrajaya menyarankan kepada semua untuk menangguhkan perjalanan ke negara-negara yang berisiko tinggi berikutan varian Omicron yang kian menular. 

Dapatkan vaksin COVID-19 termasuk dos penggalak sebagai usaha kita melindungi diri dan keluarga tersayang. https://t.co/a6b8zeBYx9",39,25,722
723,Moza70945403,"Covid 19 belum selesai,kita akan menghadapi varian baru dari covid 19 yaitu omicron,jaga ke sehat,taati prokes yang ada,ingat tiga M,memakai masker,mencuci tangan dan hindari kerumunan masa dan jangan lupa vaksin....",1,0,723
724,SumateraMedia,"Hari Gini Masih Ada Warga Merangin Gagal Paham Vaksin Covid-19, Capaian Vaksinasi Pun Rendah | MediaLintasSumatera https://t.co/a1ajzrPeEQ https://t.co/RqKc7QlUsx",0,0,724
725,ripp_twts,"Ambil vaksin sebagai ikhtiar melawan Covid-19 ❌
Ambil vaksin sebab nak masuk mall ✅ https://t.co/Gm5Fcw5O6e",2,0,725
726,sonorafmjogja,#SelamatPagiJogja l #TribunJogja l Puluhan siswa Yayasan Kanisius mendapat vaksin Covid-19 #Radio #SonoraFMYogyakarta,0,0,726
727,Kusumawati2Rini,"UPP Kab. Bantaeng melaksanakan giat pengamanan &amp; pendampingan vaksin covid-19 di desa bonto bulaeng kec. Sinoa Sekaligus sosialisasi sapu bersih pungutan liar, melalui media masker yang digunakan oleh personil yg berlogokan saber pungli &amp; pemda",0,0,727
728,asumsico,"Pemerintah pakai dua skema pemberian booster vaksin Covid-19. Apa saja?

https://t.co/TW0tFT3PHe",9,3,728
729,TutyHer4ww,UPP Kab. Bantaeng melaksanakan giat pengamanan &amp; pendampingan vaksin covid-19 di desa mappilawing kec. Eremerasa Sekaligus sosialisasi sapu bersih pungutan liar,0,0,729
730,Bisniscom,"Siap Impor 10 Juta Vaksin Covid-19, Kalbe Farma Tunggu Izin Penggunaan GX-19N https://t.co/WkL92D8xSl",0,0,730
731,KAI121,@brompton031 Selamat pagi Kak. Saat ini syarat perjalanan KA merujuk SE nomor 112/2021 Kemenhub. Penumpang KA Antar Kota seperti #Probowangi wajib menunjukkan surat keterangan negatif Covid-19 berdasarkan Rapid test antigen atau RT-PCR dan kartu/sertifikat vaksin. |1,0,0,731
732,kumaedi07,"@mporatne Alhamdulillah, meski begitu kita harus vaksin untuk meningkatkan imun biar kuat apabila terpapar covid-19",0,0,732
733,InfoFarmasiKini,Thailand Kembamgkan Vaksin COVID-19 Omicron Berbasis Tanaman Daun Tembakau https://t.co/lJk4govm0v,0,0,733
734,farmasetika_com,Thailand Kembamgkan Vaksin COVID-19 Omicron Berbasis Tanaman Daun Tembakau https://t.co/eKcByL13fJ,0,0,734
735,__anomali__,"namanya juga PENYAKIT BAWAAN ... sudah lama dibawa-bawa, gak juga mati...  begitu disuntik Vaksin Covid-19 eh langsung mati

kesimpulan : ini karena penyakit bawaan",108,38,735
736,MalutSua,"Meninggal sebelum di Vaksin karena Covid_19,, meninggal setelah di Vaksin karena ada penyakit bawaan itulah dunia...",0,0,736
737,sdmimamsyuhodo,"Selasa (28/12) telah dilaksanakan vaksin Covid-19 dosis 1 di SD Muhammadiyah Imam Syuhodo secara bertahap untuk kelas 3, 4, dan 6.

- Taqwa, Kreatif, Peduli - https://t.co/gKiGZFkYNG",4,0,737
738,zsectumsempra,"untuk menangani pasndemi covid 19, pemerintah berupaya keras dalam penyediaan vaksin di Indonesia #SemangatBangkitkanNKRI https://t.co/tgClfEeZAM",0,0,738
739,_oodelia,"Tangani pandemi covid-19 Pemerintah RI berupaya keras untuk menyediakan vaksin
#SemangatBangkitkanNKRI https://t.co/Ui97LSQy6z",0,0,739
740,okezonenews,"Novak Djokovic Masih Bungkam soal Status Vaksin Covid-19, Begini Tanggapan Stefanos Tsitsipas #LengkapCepatBeritanya #Olahraga #Sport #Bulutangkis #Netting #Badminton . https://t.co/Nlkcz82GCg",0,0,740
741,KAI121,@hufflepufu Selamat pagi Kak. Merujuk SE nomor 112/2021 Kemenhub. Penumpang KA Antar Kota usia 12 tahun atau lebih wajib menunjukkan sertifikat vaksin dan hasil negatif Covid-19 berdasarkan Rapid test antigen/RT-PCR. |1,0,0,741
742,GrogolPolsek,"Pandemi Covid-19 belum berakhir yaa Sobat Polri. Untuk itu, sebagai langkah menghindari penyebarannya, penting bagi kita untuk disiplin protokol kesehatan di manapun berada dan segera vaksin dosis lengkap.

#PatuhiProkesNataru
Waspada Varian Baru https://t.co/XGTtopYAlq",0,0,742
743,CNNIndonesia,"Banjir di Brasil Tewaskan 20 Orang, Rusak Stok Vaksin Covid-19 https://t.co/4kRymGE2Kp",9,3,743
744,GirimulyoPolsek,"Unsur Forkopimkap Girimulyo memantau kegiatan vaksinasi Covid-19 pada anak usia 6-11 tahun yang di laksanakan pada hari Senin (27/12/2021).

Dari hasil monitoring kegiatan vaksinasi tercapai 251 siswa-siswi dapat di berikan suntikan vaksin sinovac dosis pertama.

@ResKulonprogo https://t.co/KdBXbWNksi",0,0,744
745,ElshintaTegal_,Penerima dosis lengkap vaksin COVID-19 capai 111.565.302 orang https://t.co/WLtq9vqt85,0,0,745
