,Username,Tweet,Likes,Retweets,No
0,FirmRei,"Antisipasi Penyebaran Covid -19, Polisi Sidoarjo Gelar Razia Vaksin Covid-19 dan Prokes di Batas Kota https://t.co/yTGFYBUKUL",0,0,0
1,POLRES_PASER,"10 Vaksin Covid-19 Yang Sudah Dapatkan Izin Penggunaan Darurat Dari BPOM

Sobat Polri, yuk kita simak berikut adalah daftar vaksin Covid-19 yang sudah mendapatkan izin penggunaan darurat dari BPOM! https://t.co/Diib7lFG4b",3,0,1
2,detikcom,"Siswa SD di Jombang, Jatim meninggal kurang dari 24 jam usai mendapat vaksin COVID-19 Pfizer. Disimpulkan tak terkait vaksin, tapi penyebab pasti masih gelap. https://t.co/ZKEIQP97DT",5,5,2
3,detikHealth,"Siswa SD di Jombang, Jatim meninggal kurang dari 24 jam usai mendapat vaksin COVID-19 Pfizer. Disimpulkan tak terkait vaksin, tapi penyebab pasti masih gelap. https://t.co/iQXAGU26Ph",1,1,3
4,asumsico,"Beberapa pasien omicron di Indonesia juga telah menerima dua dosis suntikan vaksin Covid-19.

https://t.co/kWqE546C3k",9,6,4
5,jabarekspres,"Kerja Sama Bilateral Vaksin Covid-19, Indonesia Hemat Rp13 Triliun https://t.co/Kp5BtJUOLB",0,0,5
6,kodim_1704,"Komsos, Babinsa Koramil 1802-02/Sorong Barat Himbau Warga Untuk Ikut Vaksin Covid-19 - https://t.co/h4D91LufBS",0,0,6
7,wulanutari52,"Vaksin Dan Protokol Kesehatan Saling Melengkapi Sebagai Lapisan Proteksi
mengandalkan vaksin saja tidak cukup agar tidak tertular virus Covid-19, menerapkan protokol kesehatan yang ketat adalah upaya melengkapi intervensi kesehatan https://t.co/RWC5Km1Tgq",19,18,7
8,Anggita_lung,"Bagi masyarakat yang belum di vaksin covid-19 segera menuju posko vaksinasi terdekat untuk di vaksin.
Bagi yang sudah di vaksin tetap disiplin PROKES untuk mencegah penularan covid-19.
Vaksinasi covid-19 dan PROKES disiplin menciptakan HERD IMMUNITY.
@jokowi Lawan Pandemi https://t.co/8PQgS99kcQ",20,18,8
9,abi_sasaLL,"Masyarakat yg belum menerima vaksin COVID-19 untuk segera divaksin,jga yg belum mendapatkn vaksin kedua, untuk segera mendatangi fasilitas layanan kesehatan.
Upaya ini dapat mempercepat   tercapainya kekebalan kelompok serta mencegah meluasnya penyebaran varian omicron. https://t.co/piRSeIZ0sT",17,17,9
10,detikHealth,"Tercatat sudah 68 kasus COVID-19 kasus Omicron di Indonesia. Mayoritas berasal dari Turki dan Arab Saudi, tak bergejala dan sebagian besar sudah vaksin lengkap. https://t.co/duW5DhsOu9",2,1,10
11,EkinLatep,"@ourprettystuffs Ayo vaksin, karena vaksin itu gratis dan semoga kita bisa terhindar dari virus covid-19",0,0,11
12,KabarSiang,Kerjasama Bilateral Pengadaan Vaksin Covid-19 Diklaim Hemat Rp13 Triliun https://t.co/3G7T5tavUV #vaksinkemenkescovid,0,0,12
13,sarahbodor,2022 semoga distribusi vaksin booster cepat menyebar merata biar tingkat kasus Covid 19 Indonesia gak usah melonjak tinggi lagi kayak negara-negara luar sekarang.,0,0,13
14,pantau24jam,Penerima Vaksin COVID-19 Dosis Satu Tambah Satu Juta Lebih Orang https://t.co/E10tLoEgsz,0,0,14
15,ThaminahNaila,UPP Kab. Bantaeng melaksanakan giat pengamanan &amp; pendampingan vaksin covid-19 di desa mappilawing kec. Eremerasa Sekaligus sosialisasi sapu bersih pungutan liar,0,0,15
16,FunderRei,Ditintelkam Polda Sumbar Gelar Vaksin Covid-19 di Dua Kabupaten https://t.co/CundPcyxyQ,0,0,16
17,detikcom,Muhammad Bayu Setiawan (12) meninggal kurang dari 24 jam setelah disuntik vaksin COVID-19 jenis Pfizer dosis pertama. Ini penjelasan Dinkes: https://t.co/mBB8AvvEjR,21,13,17
18,KAI121,"@aaprianto43 KAI berkomitmen untuk mencegah penyebaran COVID-19 dengan menerapkan prokes ketat, semua penumpang KA diwajibkan sudah vaksin dan wajib melakukan skrining dengan RT-PCR/RDT Antigen pada perjalanan KA antar kota. Trims.|2",0,0,18
19,RadioElshinta,"Badan Pengawas Obat dan Makanan Indonesia sudah memberikan izin penggunaan darurat pada 10 jenis vaksin COVID-19, yakni Sinovac, AstraZeneca, Sinopharm, Moderna, Pfizer, Novavax, Sputnik-V, Janssen, Convidencia, dan Zifivax. via @kemkominfo https://t.co/qRKRSlqEDY",2,0,19
20,VIVAcoid,Joki Vaksin di Belgia Ditahan Setelah 8 Kali Divaksin COVID-19 https://t.co/iOrlAhgLvZ,1,1,20
21,HendraP32952551,"Selama Tahun 2021, Polres Probolinggo Berpartisipasi Suntik 77.240 Dosis Vaksin Covid-19 https://t.co/las8fyc9uz",1,0,21
22,suhazeli,2 dos vaksin mampu meneutralkan varian Omicron. Manakala 3 dos boleh meningkat kemampuan 25 kali. Antibodi setelah vaksinasi boleh mengenal 80% rupa (spike protein) varian omicron. Oleh sebab itu vaksin memainkan peranan penting dalam menurunkan wabak Covid-19. https://t.co/4YjV7pg0eh,147,100,22
23,beritasampit_id,"#BeritaSampit
113 Juta Jiwa Penduduk Indonesia Telah Mendapatkan Vaksin COVID-19 Dosis Kedua https://t.co/wqlpHV2xbC JAKARTA - Satuan Tugas (Satgas) Penanganan COVID-19 melaporkan pen... https://t.co/NsbQMdQkzt",0,0,23
24,lesyeuxdeniny,"@thelumencrux Keknya si ibu2 itu nyeritain kek kejamnya covid-19 dengan adanya org sakit, invest RS naik, terus org² yg keji berdasi pd mudah dpt uang gitu, jadi 1 mayat covid dijadiin uang sih ifu yg kutangkep sblm ada si vaksin yg beraneka ragam jenisnya wkwk",2,1,24
25,Gadis_Kampungk,"Semua Vaksin pasti untuk meningkatkan Immun dan terhindar dari  Covid -19, gag perlu pilih-pilih semua sama #BerharaTakBerpisah https://t.co/zYUfrpOkce",0,0,25
26,KAI121,"@BayuAdi2709 Selamat malam. Sampai saat ini masih dilakukan pembatasan kapasitas maksimal dalam perjalanan kereta api, sesuai dengan peraturan yang berlaku. PT. KAI berkomitmen untuk mencegah penyebaran COVID-19 dengan menerapkan prokes ketat, semua penumpang KA diwajibkan sudah vaksin dan |1",0,0,26
27,Beritasatu,Data Penerima Vaksin Covid-19 sampai 30 Desember 2021 https://t.co/0htd1LNYyI https://t.co/ojI3VUkYmU,3,1,27
28,pakarnur,"#Nonton Bareng Final AFF#Aceh Tamiang#Vaksin Covid-19!

Ajang nonton bareng Final AFF, Indonesia-Thailand pada Rabu (29/12/2021) malam menjadi area vaksin Covid-19.

https://t.co/dAnaxJHUXY",0,0,28
29,serambinews,"#Nonton Bareng Final AFF#Aceh Tamiang#Vaksin Covid-19!

Ajang nonton bareng Final AFF, Indonesia-Thailand pada Rabu (29/12/2021) malam menjadi area vaksin Covid-19.

https://t.co/AuZYA850aN",0,0,29
30,ahmadzackariaaa,UPP Kab.Bantaeng melaksanakan giat pengamanan &amp; pendampingan vaksin covid-19 di kel.ereng-ereng kec.tompobulu Sekaligus sosialisasi sapu bersih pungutan liar...🖐️🖐️🖐️ https://t.co/3XKJOfeSrP,0,0,30
31,ahmadzackariaaa,UPP Kab.Bantaeng melaksanakan giat pengamanan &amp; pendampingan vaksin covid-19 di desa barua kec.eremerasa Sekaligus sosialisasi sapu bersih pungutan liar...🖐️🖐️🖐️ https://t.co/HvNLqCOqXN,0,0,31
32,ahmadzackariaaa,UPP Kab.Bantaeng melaksanakan giat pengamanan &amp; pendampingan vaksin covid-19 di kel.bonto manai kec.bissappu Sekaligus sosialisasi sapu bersih pungutan liar...🖐️🖐️🖐️ https://t.co/htOHEuzxgY,0,0,32
33,ahmadzackariaaa,UPP Kab.Bantaeng melaksanakan giat pengamanan &amp; pendampingan vaksin covid-19 di desa mappilawing kec.eremerasa Sekaligus sosialisasi sapu bersih pungutan liar...🖐️🖐️🖐️ https://t.co/b3duTsWikW,0,0,33
34,ahmadzackariaaa,UPP Kab.Bantaeng melaksanakan giat pengamanan &amp; pendampingan vaksin covid-19 di desa batu karaeng https://t.co/yTZoiwTdHM'jukukang Sekaligus sosialisasi sapu bersih pungutan liar...🖐️🖐️🖐️ https://t.co/Qhb9PQW37K,0,0,34
35,ahmadzackariaaa,UPP Kab.Bantaeng melaksanakan giat pengamanan &amp; pendampingan vaksin covid-19 di desa tombolo kec.gantarangkeke Sekaligus sosialisasi sapu bersih pungutan liar...🖐️🖐️🖐️ https://t.co/eeN5WapwZP,0,0,35
36,ahmadzackariaaa,UPP Kab.Bantaeng melaksanakan giat pengamanan &amp; pendampingan vaksin covid-19 di desa bonto tappalang kec.tompobulu Sekaligus sosialisasi sapu bersih pungutan liar...🖐️🖐️🖐️ https://t.co/VXhvpPX78F,0,0,36
37,ahmadzackariaaa,UPP Kab.Bantaeng melaksanakan giat pengamanan &amp; pendampingan vaksin covid-19 kel.campaga kec.tompobulu Sekaligus sosialisasi sapu bersih pungutan liar...🖐️🖐️🖐️ https://t.co/Bd6YzmwD3h,0,0,37
38,ahmadzackariaaa,UPP Kab.Bantaeng melaksanakan giat pengamanan &amp; pendampingan vaksin covid-19 di kel.tappanjeng kec.bantaeng Sekaligus sosialisasi sapu bersih pungutan liar...🖐️🖐️🖐️ https://t.co/TYFyyzozP1,0,0,38
39,PT_Transjakarta,"@Elvacs Hai kak. Saat ini pengaturan kapasitas maksimal 100% (seratus persen dan Seluruh pelanggan Transjakarta wajib menunjukkan sertifikat vaksin Covid-19 untuk dapat mengakses seluruh layanan Transjakarta, baik melalui aplikasi Jaki, PeduliLindungi atau sertifikat vaksin. ^ZL",1,0,39
40,ZonaKaltara,"Diawasi Ketat! Nakes Rumah Sakit di Israel Mulai Dapatkan Dosis Keempat Vaksin Covid-19
#Vaksinasi #COVID19 #Israel

https://t.co/yc4HiVElsn",0,0,40
41,justinfogarut,"Baru Dimulai, Yuk Warga Garut Ajak Anak-Anak Vaksin Covid-19
https://t.co/CZ0BdWyYyO",0,0,41
42,angusberesford,Indonesia Hemat Rp13 Triliun dari Kerja Sama Bilateral Vaksin Covid-19 https://t.co/0TmQ9bA8rB,0,0,42
43,carilahmas,Indonesia Hemat Rp13 Triliun dari Kerja Sama Bilateral Vaksin Covid-19 https://t.co/jJcHKwPxZQ,0,0,43
44,polisisijunjung,"Akselerasi Vaksin Covid-19, Ditintelkam Polda Sumbar gelar Vaksinasi di Dua Kabupaten https://t.co/kuaGQXCCJh",0,0,44
45,hariankompas,"Polres Pinrang Sulawesi Selatan menetapkan Abdul Rahim sebagai tersangka kasus joki vaksin. Ia mengaku disuntik vaksin COVID-19 sebanyak 17 kali. #VideoBerita #AdadiKompas

https://t.co/VfZrACqA5n",1,0,45
46,kompascom,"Menurut Prasenohadi, tidak adanya gejala pada orang yang terpapar varian Omicron menandakan bahwa efektivitas vaksin Covid-19 bekerja dengan baik. https://t.co/KxFxwhgZFh",3,2,46
47,PR_Tasikmalaya,Segini Jumlah Warga Indonesia yang Telah Mendapatkan Vaksin Dosis Kedua Covid-19 https://t.co/vaecuICsiF,0,0,47
48,voidotid,Juru Bicara Kementerian Kesehatan RI Siti Nadia Tarmizi mengemukakan kerja sama bilateral dalam pengadaan vaksin COVID-19 di Indonesia telah menghemat anggaran negara Rp13 triliun. https://t.co/PJosA63SF2,0,0,48
49,merdekadotcom,Indonesia Hemat Rp13 Triliun dari Kerja Sama Bilateral Vaksin Covid-19 https://t.co/Llb0HJsf3S,1,0,49
50,PR_Tasikmalaya,Segini Jumlah yang Telah Mendapatkan Vaksin Dosis Kedua Covid-19 di Indonesia https://t.co/eUg2rNMEAu,0,0,50
51,riri_rhi,"@dr_koko28 @CNNIndonesia -&gt; terpantau sudah menerima dua dosis vaksin Covid-19.

Ahh twit ini jangan2 maksudnya dokter mau mulai menjalankan misi ayo booster?",7,1,51
52,liputan6dotcom,Kominfo Turunkan 2.525 Konten Hoaks Vaksin Covid-19 di Media Sosial https://t.co/2rzxFkk1BD,1,0,52
53,KAI121,@taniarmeisssss KAI berkomitmen untuk mencegah penyebaran COVID-19 dengan menerapkan prokes ketat. Semua penumpang KA diwajibkan sudah vaksin dan wajib melakukan skrining dengan RT-PCR/RDT Antigen pada perjalanan KA antar kota. Trims. |2,0,0,53
54,detikHealth,Ahli pulmonologi dan kedokteran respirasi FKUI menjelaskan risiko reinfeksi varian Omicron. Ia juga menyinggung pentingnya booster vaksin Covid-19 untuk melawan Omicron. Dua dosis vaksin disebut tidak cukup. https://t.co/MkmV73u4ky,3,0,54
55,lampungpost_,"Jajaran Polsek Terbanggi Besar, Lampung Tengah, bersama Satgas covid-19 setempat menggelar vaksinasi door to door dengan  sasaran   tempat hiburan malam, karaoke, hotel, dan  kafe.
#Vaksin #vaccine #vaccination #vaksindoortodoor #lampostco
https://t.co/AhRoKZQWVa",0,0,55
56,Kodam17Cen,"GELAR VAKSINASI COVID-19, BABINSA BERSINERGI DENGAN POLRES DEIYAI DAN AKTIF BERI EDUKASI KE PESERTA VAKSIN
https://t.co/bUjiMMVi19",0,0,56
57,Antara_Jabar,"113 juta penduduk RI telah mendapatkan vaksin COVID-19 dosis kedua 

https://t.co/4dATflQ64F",0,0,57
58,KAI121,@cicharaa Selamat malam Kak. Penumpang KA Aglomerasi seperti #Joglosemarkerto tidak wajib menunjukkan hasil negatif Covid-19. Silakan cukup menggunakan aplikasi PeduliLindungi yang terdapat data vaksin minimal dosis pertama. Bisa melampirkan kartu vaksin jika tidak menggunakan aplikasi. |1,0,0,58
59,ghe_tholl,"Sudah kuduga...
Semoga tidak ada lagi pemaksaan, intimidasi dll kepada rakyatnya.

Ingat! Vaksin Covid-19 Dosis 3 Tak Lagi Gratis, Cek Harganya https://t.co/2iKh6R3NjA",0,0,59
60,KAI121,"@rizqirmynt Selamat sore Kak. Perjalanan menggunakan KA Kaligung (Aglomerasi), tidak wajib menunjukkan hasil negatif test RT-PCR/Antigen. Namun wajib menunjukkan sertifikat vaksin Covid-19. Informasi lengkap, Kakak bisa cek link https://t.co/Gex6hLrT8U. Terima kasih.",0,0,60
61,santai_tv,"setahun vaksin dilancarkan, kes baharu COVID-19 di Amerika Syarikat (AS) terus melonjak ke paras tertinggi dengan 265,000 sehari secara purata. https://t.co/MyvTxDQhoN",0,0,61
62,InforakyatNet,"setahun vaksin dilancarkan, kes baharu COVID-19 di Amerika Syarikat (AS) terus melonjak ke paras tertinggi dengan 265,000 sehari secara purata. https://t.co/ZOAxYhFD2O",0,0,62
63,monologis_id,"Seorang wanita berinisial SM warga Desa Panjang, Kecamatan Runding, Kota Subulussalam, Aceh membuat postingan di akun media sosial miliknya. Dia menulis; alat vital suaminya sakit setelah di suntik vaksin COVID-19.

https://t.co/H2Jd4u39WI",0,3,63
64,hayyanarzbakery,SUNTIKAN KE-3 VAKSIN COVID-19 https://t.co/CF7rhJBGUQ,0,0,64
65,InfokomPMK,"Yuk, adik-adik yang berumur 6-11 persiapkan diri untuk melakukan vaksin, ya! Bersama kita bisa lawan virus Covid-19!
#vaksinanak #COVID19",0,0,65
66,InfokomPMK,"Sob, vaksin anak usia 6-11 tahun akan segera dimulai, lho! 

Vaksinasi akan dilakukan dengan jenis vaksin Sinovac (Coronavac/Covid 19 Biofarma), untuk jenis vaksin yang lain masih menunggu EUA BPOM dan rekomendasi ITAGI, Sob. https://t.co/PTB2Ak08Yw",0,0,66
67,SatbrimobdaGor1,"PENGAMANAN VAKSIN COVID-19.

Penjagaan Kantor Instalasi Farmasi Dinas kesehatan Provinsi Gorontalo, Satbrimobda Gorontalo memastikan vaksin tersebut tersimpan aman hingga ke masyarakat. https://t.co/2gmqoBdxB1",0,0,67
68,Antara_Kalteng,Sudah 113 juta jiwa mendapatkan vaksin COVID-19 dosis kedua https://t.co/cqpotnjHsU,0,0,68
69,TehManisPanas4,"Masih anti vaksin? Juara Dunia Kickboxing sekaligus Anti-vaksin Meninggal karena Covid-19

Klik untuk baca: https://t.co/ay0793GWPb",0,0,69
70,merdekadotcom,113 Juta Penduduk RI Sudah Disuntik Vaksin Covid-19 Dosis Kedua https://t.co/M5rAbFVuxI,0,0,70
71,BerusahaBaik20,"Apa susahnya ikut vaksinasi? Aman, halal, gratis, dan tubuh mendapat antibodi tambahan. Juara Dunia Kickboxing sekaligus Anti-vaksin Meninggal karena Covid-19
Klik untuk baca: https://t.co/iZ5XEk9lab",0,0,71
72,humas_smd,Update vaksin covid 19 Kabupaten Sumedang https://t.co/bA4bMlZGej,4,0,72
73,sumbarlivetv1,"Akselerasi Vaksin Covid-19, Ditintelkam Polda Sumbar gelar Vaksinasi di Dua Kabupaten  https://t.co/iD6mON1a6H",0,0,73
74,PT_Transjakarta,"Seluruh pelanggan Transjakarta wajib menunjukkan sertifikat vaksin Covid-19 untuk dapat mengakses seluruh layanan Transjakarta, baik melalui aplikasi Jaki, PeduliLindungi, dan/atau sertifikat vaksin yang dikeluarkan oleh lembaga yang berwenang.",0,0,74
75,Jelajah513,"Sebagian pasien terpapar Omicron yang dirawat di RSPI juga terpantau sudah menerima dua dosis vaksin Covid-19.
Melihat hal ini apa pemerintah dan para ahli kesehatan yg pintar2 di Indonesia tdk berpikir ulang ttg vaksin ?
atau akan tetap ngotot melanjutkan pemaksaan vaksin..? https://t.co/ZswQ9I9CsN",0,0,75
76,antaranews,"Petugas Kepolisian Sektor Padang Selatan, Sumatera Barat, memeriksa sertifikat vaksin setiap pengunjung yang akan memasuki kawasan wisata Pantai Air Manis guna mencegah penyebaran COVID-19. 

Selengkapnya:
https://t.co/lYFoD1Wkni https://t.co/NZdr59TW3L",3,0,76
77,okezonenews,Ilmuwan Thailand Kembangkan Vaksin Covid-19 Menggunakan Tembakau #LengkapCepatBeritanya #BeritaTerkini #Kampus #KampusUpdate . https://t.co/a4w02JYr2V,0,0,77
78,satbrimob_malut,Personel Kompi 1 Batalyon C Pelopor Satuan Brimob Polda Maluku Utara melaksanan giat pengamanan di area pelaksanaan vaksinasi yang dilaksanakan di Desa Lelilef Sawai untuk memberikan rasa aman dan nyaman kepada masyarakat yang sedang melaksanakan vaksin Covid-19 https://t.co/QDbZlRr1Yn,2,0,78
79,KompasTV,2 Dokter Penjual Vaksin Covid-19 Divonis 2 Tahun Penjara https://t.co/E39OWo6Ruj https://t.co/f3VrZSEEOq,5,0,79
80,HumasPolresHST9,Ucapan terimakasih dari kelurahan Barabai Darat kepada Bhabinsa dan Bhabinkmtibmas atas kenarja sehingga kel Barabai Darat mendapat juara satu tertinggi sekabupaten pencapaian vaksin Covid 19 https://t.co/e0NlDFO8Hr,0,0,80
81,tribunpontianak,"Kades Sungai Ambawang Kuala Siapkan Doorprize Bagi Warga yang Vaksin COVID 19
 
https://t.co/ATdkvvPtUL lewat @tribunpontianak",0,0,81
82,jatengtodaycom,"Tak Hanya Pelajar, Anak Jalanan Juga Berhak Dapat Vaksin Covid-19 https://t.co/jlVtMEqrK3",0,0,82
83,POLSEK_JOHAR,"Jl. Rawa Tengah Rw.06 Kel. Galur Johar Baru Jakarta Pusat. Kegiatan Vaksin Anak Usia 6-11 tahun tersebut merupakan upaya percepatan Vaksinasi Nasional Covid-19 di tingkatan PAUD, TK dan SD.",0,0,83
84,POLSEK_JOHAR,"Jl. Pandawa Rw.05 Kel. Tanah Tinggi Johar Baru Jakarta Pusat. Kegiatan Vaksin Anak Usia 6-11 tahun tersebut merupakan upaya percepatan Vaksinasi Nasional Covid-19 di tingkatan PAUD, TK dan SD.",0,0,84
85,POLSEK_JOHAR,"Vaksin Sinovac di GOR JOHAR BARU, Jl. Rawa Selatan IV Rw.03 Kel. Johar Baru Jakarta Pusat. Kegiatan Vaksin Anak Usia 6-11 tahun tersebut merupakan upaya percepatan Vaksinasi Nasional Covid-19 di tingkatan PAUD, TK dan SD.",0,0,85
86,KAI121,@dionysiadn KAI berkomitmen untuk mencegah penyebaran COVID-19 dengan menerapkan prokes ketat. Semua penumpang KA diwajibkan sudah vaksin dan wajib melakukan skrining dengan RT-PCR/RDT Antigen pada perjalanan KA antar kota. Terima kasih. |2,0,0,86
87,detikHealth,"Seorang anak SD meninggal pasca divaksinasi COVID-19, beberapa waktu setelah dikhitan. Komnas KIPI menyimpulkan tak terkait vaksin maupun obat khitan. https://t.co/5kqYj8KRTj",2,0,87
88,detikcom,"Seorang anak SD meninggal pasca divaksinasi COVID-19, beberapa waktu setelah dikhitan. Komnas KIPI menyimpulkan tak terkait vaksin maupun obat khitan. https://t.co/OtwbUVtV1X",10,5,88
89,kabardaily,Gerai Vaksin Satgas Covid-19 Lanud SIM Laksanakan Serbuan Vaksinasi Setentak di Blang Bintang https://t.co/0HloTl4EfW,0,0,89
90,SukoharJOS,"8 Hari, 5.151 Anak Sukoharjo Usia 6-11 Tahun Disuntik Vaksin Covid-19 - Solopos https://t.co/nDFzNDh0gN
#Sukoharjo #SukoharjoMakmur #BeritaSukoharjo",0,0,90
91,pidressitubondo,Sinergitas Satgas Covid 19 Kecamatan Panji Laksanakan Grebek Vaksin Di Supermarket Royal https://t.co/sTfqy8WQh4,1,1,91
92,InspiratifPapua,"Deng Vaksin Kitong Aman Dari Bahaya Covid-19

Ayo... Vaksin https://t.co/QG9Ln6hAFp",0,0,92
93,KontanNews,"UPDATE Vaksinasi Covid-19 Per 30 Desember: Ada Penambahan 1,78 Juta Dosis Vaksin https://t.co/GDTe01aFBl #VaksinasiCovid-19",0,0,93
94,NarasiNewsroom,"Dengan rincian, 51 orang sudah menerima dua dosis vaksin, 6 orang baru mendapat satu dosis vaksin, 7 orang sama sekali belum menerima vaksin COVID-19, dan 4 lainnya masih dalam konfirmasi.

#NarasiNewsroom",2,0,94
95,Papua__Ku,Deng Vaksin Kitong Aman Dari Bahaya Covid-19 https://t.co/VLMQn0D05H,0,0,95
96,irasjafii,"Menjelang akhir th  situasi covid-19 di Depok; 19 kasus aktif per kemarin dan 22% pddk yg belum vaksin, serta laporan kasus di rs tempat saya kerja hanya 1 org yg dirawat, berharap memasuki 2022 dg optimis. Asalkan semua tetap displin gunakan masker dan bijak dlm berkumpul. https://t.co/1Oi9gQLB6X",15,3,96
97,poldasulut_,"SINERGITAS TNI - POLRI 

Vaksin sehat dan tidak berbahaya, ayo kita vaksin sobat polri untuk mencegah penyebaran Covid-19 

#humaspoldasulut https://t.co/9rrodWnhWh",1,0,97
98,andikceritanya,"Apalagi dg kasus Omicron yg terus naik maka pemerintah jg berencana mempercepat pelaksanaan program vaksinasi dosis ke-3 atau booster Covid-19. Percepatan ini mempertimbangkan meningkatnya penularan Covid-19 varian Omicron dan menurunnya efikasi vaksin. 

#BerharapTakBerpisah",0,0,98
99,Iren___E,"Dengan Vaksin Kitong Aman Dari Bahaya Covid-19

Ayo... Vaksin https://t.co/4lY73qM2xZ",0,0,99
100,kumparan,Orang tua harus mengajak anak tentang pentingnya vaksin COVID-19. #satgascovid19 #kumparanNEWS https://t.co/Cesy8uKm6Y,2,1,100
101,soloposdotcom,"8 Hari, 5.151 Anak Sukoharjo Usia 6-11 Tahun Disuntik Vaksin Covid-19 https://t.co/SxEk2xjOPf",0,0,101
102,LampungHumas,"Perpres No 14 Th 2021, Tentang pengadaan Vaksin dan Pelaksanaan Vaksinasi COVID-19 https://t.co/1MvwXcdqAb",1,0,102
103,detikcom,Nama vaksin Covid-19 Indonesia ada 10 yang telah mendapatkan EUA BPOM. Berikut daftarnya. https://t.co/OHosRVjBmS,9,1,103
104,hariankompas,"Ketidaksetaraan vaksinasi Covid-19 dan berbagai upaya mencegah penularan membuat pandemi sulit diakhiri. Kesenjangan akses terhadap vaksin tersebut menyebabkan varian baru akan terus bermunculan. #Iptek #AdadiKompas @aik_arif 

https://t.co/j74tvars7y",0,2,104
105,Bisniscom,WHO: Varian Baru Virus Corona Bisa Membuat Vaksin Covid-19 Menjadi Tidak Efektif https://t.co/JDfpqeDqqK,32,13,105
106,08Kemiri,Babinsa Koramil 08/Kmr Kodim 0708/Pwr  Melaksanakan Pendampingan Vaksin Covid 19 di wilayah Purworejo https://t.co/0C31YuDyBd,0,0,106
107,kumaedi07,"Karena gak mau kenapa napa sama badan. Alhamdulillah belum terpapar covid-19. Karena memang aku sangat menjaga pola makan dan sudah vaksin lengkap.

#BerharapTakBerpisah https://t.co/D62MgC9hQv",2,0,107
108,08Kemiri,BABINSA KORAMIL 08/ KMR MENDAMPINGI WARGA MENERIMA VAKSIN COVID-19 https://t.co/9uP3Hdkv8y,0,0,108
109,archa_bella,"Vaksin ini memiliki bentuk sediaan vial 5 ml. Setiap vial berisi 10 dosis vaksin yang berasal dari virus yang di-inaktivasi.
Untuk menjaga mutu kualitasnya, vaksin Covid-19 tersebut harus disimpan dalam tempat penyimpanan dengan suhu stabil antara 2-8°C
 #BerharapTakBerpisah https://t.co/Xi2JZ7LzpW",0,0,109
110,archa_bella,"3.Coronavac/Vaksin PT Bio Farma

Coronavac merupakan vaksin Sinovac yang diproduksi oleh PT Bio Farma.

BPOM menerbitkan izin penggunaan darurat untuk vaksin Covid-19 yang diproduksi PT Bio Farma pada 16 Februari 2021.

#BerharapTakBerpisah",0,0,110
111,archa_bella,"2. AstraZeneca

AstraZeneca merupakan vaksin Covid-19 buatan perusahaan farmasi Inggris, AstraZeneca dan University of Oxford yang diproduksi dengan prinsip adenovirus.
BPOM menerbitkan EUA vaksin AstraZeneca 22 Feb 2021.
#BerharapTakBerpisah",0,0,111
112,archa_bella,"#BerharapTakBerpisah 
Sejumlah jenis vaksin Covid-19 sedang proses registrasi di BPOM untuk menjadi vaksin booster sejenis (homologus).",0,0,112
113,archa_bella,"#BerharapTakBerpisah 
Pihak Badan Pengawas Obat dan Makanan (BPOM) mengatakan, lima jenis vaksin Covid-19 sedang dalam proses registrasi sebagai vaksin booster di BPOM.
Kelima merek vaksin tersebut yaitu Pfizer, AstraZeneca, Coronavac/Vaksin PT Bio Farma, Zifivax, dan Sinopharm. https://t.co/jMs3zuWHBt",0,0,113
114,snnews_official,Marinir Gelar Vaksin Covid-19 Kepada Anak Usia 6 Sampai 11 Tahun https://t.co/rf0DnnWo9H,0,0,114
115,st_nurjanahh,"Meskipun telah melakukan vaksinasi Covid-19 sangat dihimbau untuk tetap mematuhi protokol kesehatan. Karena vaksin tidak membuat manusia menjadi kebal. Selain itu imbangi juga dengan mengonsumsi makanan bergizi, cukup istirahat, rutin berolahraga

#BerharapTakBerpisah",1,0,115
116,detikcom,"Pakar epidemiologi Dicky Budiman mengatakan booster vaksin COVID-19 penting bagi kelompok berisiko. Bagi yang lain, kesetaraan 2 dosis lebih penting. https://t.co/HLjTa5IX0A",4,2,116
117,MarianusNore,"Kitorang sudah Vaksin
Kitorang aman dari Covid-19 https://t.co/t96k6Edf08",0,0,117
118,humaspoldajbr,"5 Jenis Vaksin Covid-19 yang sedang proses sebagai Vaksin Booster

Kelima merek vaksin tersebut adalah: 

1. Pfizer

2. AstraZeneca 

3. Coronavac/ Vaksin PT Bio Farma

4. Zivivax 

5. Sinopharm https://t.co/O9OcS0rgFs",8,1,118
119,shafigh,"#BerharapTakBerpisah

Ingat Vaksin biar terhindar dari Covid 19 https://t.co/fHLXQcEyoh",0,1,119
120,shafigh,"#BerharapTakBerpisah

Lebih Takut di Vaksin atau lebih takut kena Covid 19 

Ha yang mana ? https://t.co/5X5KAUG5SO",1,2,120
121,wahananewsdotco,Dinkes Jombang Masih Telusuri Penyebab Siswa SD Meninggal Usai Vaksin Covid-19 https://t.co/JPU7PJX8R1,0,4,121
122,st_nurjanahh,"pemerintah terus mengkaji skema pemberian vaksin Covid-19 pada anak-anak. Tentunya apabila sudah ada pemberian izin penggunaan darurat (EUA) dan dikeluarkan BPOM, pelaksanaan vaksinasi pada anak usia 6-11 tahun sudah dimulai sejak 14 Desember 2021

#BerharapTakBerpisah",1,0,122
123,beautynesia_id,"Orang Tua Wajib Tahu! Ini Cara Cek Sertifikat Vaksin COVID-19 untuk Anak, Mudah kok! https://t.co/QYUT9sFI4f",0,0,123
124,Evi_Fadliah,"Sebelum beranjak ke resolusi 2022, jangan lupa lengkapi dulu dosis vaksin covid-19 kamu yaa!! https://t.co/0TqNzzzSnw",0,0,124
125,azzura_lhi,"Tenang stok vaksin covid-19 kita berlimpah jadi jangan pilih-pilih vaksin ya semuanya aman. yang penting itu jangan ditunda-tunda deh

#BerharapTakBerpisah https://t.co/Ouvpq4r6Cn",0,0,125
126,st_nurjanahh,"vaksin Covid-19 pada kelompok anak-anak menjadi satu hal yang juga darurat. Sebagai bentuk perlindungan diri dan kewaspadaan

#BerharapTakBerpisah",1,0,126
127,suaradotcom,"Beberapa negara di seluruh dunia telah mengizinkan vaksin Covid-19 untuk anak. Indonesia sendiri telah memberikan izin suntik vaksin untuk anak usia 6-11 tahun.

#sudahdivaksintetap3m
#vaksinmelindungikitasemua
#ingatpesanibu https://t.co/O0PXJENJUj",0,0,127
128,TinaSindy,"Kalau Indonesia sudah terbebas dari Covid-19 kan enak loh, bukan cuma biat pemerintah tapi buat kita semua. Apalagi anak² yg pasti sudah rindu main bersama temannya di sekolah, bisa main seru²an lagi, lari²an lagi. Makanya yuk vaksin, Indonesia pasti bisa
#BerharapTakBerpisah",0,0,128
129,ungayossy29,Saya mah lebih memilih taat prosesur 2x vaksin dri pada mengobati karena terpapar covid 19 #BerharapTakBerpisah,0,0,129
